プロローグ,楽天家ゲルト,村人,人狼なんているわけないじゃん。みんな大げさだなあ
プロローグ,青年ヨアヒム,人狼,いやいや、人狼とかいるよ。超いるよ。この前も僕んちの前でなんか集会みたいなのやっててさ。え、いや、無事だけど。なんか犬の鳴き声みたいなのを家の中で聞いただけだからさ。いやでも困るよね。ほら、僕んちで猫飼ってるってこの前言ったじゃん？　うん、ミケって言うんだけどさ。なんか怖がっちゃって。あ、そうだ、今度見に来る？　結構人見知りする子なんだけど。って、ゲルト、僕の話ちゃんと聞いてる？　おーい。
プロローグ,青年ヨアヒム,人狼,あれー、ゲルト寝ちゃってるよ、困ったなあ。いや、だって話す相手がいないと暇じゃない？　暇だよねえ。会議するからって集められたのにゲルトしかいないし。暇だなあ。しょうがないから必要そうなアンケートとか作っておこうかな。■１．主に参加できる時間帯とか、そういうやつ。■２．仮決定と本決定の時間の希望。■３．その他に何か希望することがあればそれ。□４．あとは自由記入欄かな。こういうのも必要だよね。
プロローグ,青年ヨアヒム,人狼,よしよし。たぶんこれで大丈夫だよね。せっかく作ったし、僕が一番最初に答えておこうっと。■１．だいたい夜かな。朝とか昼とかはちょっと大変なんだよね。■２．みんなが確認できればそれでいいんだけど、やっぱり０時に仮決定で、１時に本決定とかがちょうどいいのかな。■３．自分で作っておいてなんだけど、特に希望はないんだよなあ。□４．そして自由かあ。これも困ったなあ。あ、落書きでもしてようかな。暇だし。
プロローグ,青年ヨアヒム,人狼,やっぱダメだー。僕にはあんまり絵心とかないし、黙って絵を描くとか、ちょっと苦手なんだよね。うーん、でもゲルトは起きそうにないし。それに話相手にもあんまりなってくれないんだよね、いつも。仕方ないからちょっと散歩でもしてこようかな。うん、そうしよう。帰ってきたら誰か来てるかもしれないし。よし、そうと決まったら出かけよう。あ、そういえばミケにご飯あげなきゃいけなかったんだ。いやあ、うっかりしてなあ。
プロローグ,負傷兵シモン,人狼,
プロローグ,負傷兵シモン,人狼,議題が落ちてるようだな一応答えておくか■1 23:00以降だな夜明け後少しいれるかと思うが
プロローグ,負傷兵シモン,人狼,■2 なので仮は早くても00:00希望だな本決定は1:00ぐらいでもいいぞ■3 その他の希望は別にないな強いて挙げるなら投票COはややこしそうなので遠慮したい!!
プロローグ,負傷兵シモン,人狼,別に良い方法があるなら反対はしないと言っておこう
プロローグ,負傷兵シモン,人狼,